x***n,2016-12-26 11:57:18,[升级版]男藏青,XL,不错
x***n,2016-12-26 11:56:49,[升级版]男深灰,XL,不错
梅***2,2016-12-26 11:56:44,[升级版]女紫罗兰,L,帮姐姐买的，衣服收到了，这两天忙，现在才上来，衣服很保暖贴身，膝盖还有加绒的非常温暖，很满意。还会光临。
永***树,2016-12-26 11:52:49,【超柔版】女红色,L,穿着好舒服，好暖和啊，喜欢的快点下手吧
g***j,2016-12-26 11:52:49,[升级版]女紫罗兰,XXL,严重掉绒毛，这个价钱不值得
步***9,2016-12-26 11:51:11,【超柔版】男藏青,XXL,严重码号虚标，标上正常码号会死吗，小号标成大号有意思吗
冰***4,2016-12-26 11:50:33,【尊享版】男酒红,XXXL,没想到我选的大码的还是小啦 真不咋滴
肖***5,2016-12-26 11:48:06,[升级版]男藏青,XXXL,给我爸爸买的，，还不知道怎么样，，
g***c,2016-12-26 11:46:55,【尊享版】男藏青,XXL,XXL 因为洗了所以没法退了 真心想退 裤子紧的很什么一样 本人169 140斤 腋下和腰部 紧的不舒服 本人标准身材 不是胖子  质量一般 习惯好评 再见
y***3,2016-12-26 11:46:49,【超柔版】男藏青,XXL,感觉还可以
我***4,2016-12-26 11:46:26,【超柔版】男酒红,XL,给老爸买的，他很满意，很厚实，很舒服，最重要的是保暖，明年再来买
6***y,2016-12-26 11:46:24,【超柔版】女紫色,XXXL,很好，码很准，妈妈穿上刚刚好
1***g,2016-12-26 11:44:43,【超柔版】男浅灰,L,衣服还可以，就是码号偏小了
初***朵,2016-12-26 11:43:55,【尊享版】男浅灰,L,我只想说，这个衣服码不足，要买的请多加几个型号！
萍***0,2016-12-26 11:43:09,[升级版]男藏青,XXL,还行吧，帮爸爸买的有点大了！没见实物不知道咋样！发货挺快的
名***空,2016-12-26 11:41:13,【超柔版】男浅灰,XXL,穿了才来评价的，穿上很暖和，而且款式也不错，
2***玉,2016-12-26 11:39:37,[升级版]男藏青,XL,衣服收到了大小刚好很满意。快递也行
c***6,2016-12-26 11:37:22,【尊享版】男浅灰,XL,第三次购买了，这款比较薄，但是很柔软！！穿起来比较舒服！！好评！
小***1,2016-12-26 11:37:19,【尊享版】男深灰,XL,买了两件，真的很暖和
赵***隆,2016-12-26 11:37:09,[升级版]男藏青,XXL,好好
z***7,2016-12-26 11:36:35,【尊享版】男浅灰,L,这是买的第二件了，个人觉得挺好的这个价格能买到这样的衣服也是物有所值了！
小***1,2016-12-26 11:33:51,【超柔版】男藏青,XL,不错，挺暖和的。就是上衣有点点小。这个冬天不怕冷了
陈***萍,2016-12-26 11:33:01,【尊享版】男藏青,XL,还没穿，不知道怎么样。不过手感可以。
懿***1,2016-12-26 11:27:32,【超柔版】男深灰,XXL,很暖和
懿***1,2016-12-26 11:27:32,【超柔版】男藏青,XXL,挺暖
香***香,2016-12-26 11:27:10,【超柔版】男深灰,XXXXL,还好
香***香,2016-12-26 11:27:10,【超柔版】女黑色,XXL,还好
t***3,2016-12-26 11:25:05,【尊享版】男深灰,L,此用户没有填写评论!
w***o,2016-12-26 11:23:17,【超柔版】男浅灰,XXXXL,宝贝换了一次尺码合适了，老爸老妈穿的都很合适了很高兴
可***看,2016-12-26 11:22:10,【尊享版】男浅灰,XXL,昨天到的，还不错?穿的蛮舒服
知***晋,2016-12-26 11:21:18,【超柔版】女黑色,XXXXL,保暖内衣带绒 不是很薄 穿着挺暖和的 物流也挺快的 亲们可以放心购买
知***晋,2016-12-26 11:21:18,【超柔版】女紫色,XXXXL,保暖内衣带绒 不是很薄 穿着挺暖和的 物流也挺快的 亲们可以放心购买
双***a,2016-12-26 11:19:05,【超柔版】男浅灰,XXXL,加绒的保暖内衣收到了，穿着舒服，，五星好评，推荐购买
l***贝,2016-12-26 11:18:41,【尊享版】男藏青,XL,还可以，就是拍的有点小了
绒***1,2016-12-26 11:18:27,【尊享版】男深灰,XXL,不错挺好
壹***意,2016-12-26 11:17:26,[升级版]男深灰,XXL,再不相信这家店了，，买回家穿不了，我给我爷爷奶奶各买了一套，结果穿不了，而且我在读书，爷爷奶奶在家，不方便退，他们说没有弹性，而且袖口好小，这是我最不满意的一次购物，伤心。其他人要买的，一定要擦亮眼睛。不然也会和我一样。并且物流也慢
壹***意,2016-12-26 11:17:26,[升级版]女紫罗兰,L,再不相信这家店了，，买回家穿不了，我给我爷爷奶奶各买了一套，结果穿不了，而且我在读书，爷爷奶奶在家，不方便退，他们说没有弹性，而且袖口好小，这是我最不满意的一次购物，伤心。其他人要买的，一定要擦亮眼睛。不然也会和我一样。并且物流也慢
h***8,2016-12-26 11:17:15,[升级版]女紫罗兰,L,保暖性强的内衣，手感很好舒服，质量好很厚实，很满意！
坏***1,2016-12-26 11:15:30,【尊享版】男浅灰,XL,质量不错，物有所值
雨***炎,2016-12-26 11:11:36,[升级版]男深灰,XXXXXL,买了两套了，老爸很喜欢，穿着舒服暖和，面料挺好的，下次还要光顾！
宝***逸,2016-12-26 11:09:31,【超柔版】男咖啡,XL,好评，薄了点
l***1,2016-12-26 11:09:13,【超柔版】男藏青,L,质量不错暖和
m***3,2016-12-26 11:08:32,【尊享版】男浅灰,XXL,还行
微***8,2016-12-26 11:08:31,【尊享版】男深灰,XXL,这次上当了，很不好，薄又有异味，裤子腰上的松紧太松了，简直就是没有松紧带，试问怎么穿得稳？这个价格不值
散***7,2016-12-26 11:08:13,【尊享版】男藏青,XL,质量特别好，喜欢的亲别犹豫啦，快快下单吧，大爱哦
t***0,2016-12-26 11:07:41,[升级版]男浅灰,XXXL,买大了，质量很好，
0***糖,2016-12-26 11:06:57,【超柔版】男浅灰,XL,好评！
芳***8,2016-12-26 11:06:28,【超柔版】女黑色,M,还行吧，就是衣有点小
一***幕,2016-12-26 11:06:04,【超柔版】男深灰,L,质量很不错。老公很喜欢。
炀***头,2016-12-26 11:05:40,[升级版]男深灰,XXXXXL,买过一次了，很好的
温***4,2016-12-26 11:05:01,【尊享版】男浅灰,XXL,软轻暖和，质量也很好。
h***3,2016-12-26 11:02:36,[升级版]男深灰,XXL,质量非常棒，已经是第二次够买了。
伊***斯,2016-12-26 11:02:11,【超柔版】男深灰,XL,尺码偏小一些，有些开线，还行吧。
黄***廷,2016-12-26 11:01:16,【超柔版】男浅灰,XXXXL,宝贝收到，卖家发货快服务好这款保暖内衣手感很好舒服质量好保暖很满意会再关注给好评
s***n,2016-12-26 11:00:40,【超柔版】男浅灰,L,衣服还好，裤子穿着不舒服，裤裆好高。  很柔软
杨***3,2016-12-26 10:59:46,【尊享版】男浅灰,XXL,大小合适，但是买的加绒的，也不是很厚。
芙***5,2016-12-26 10:59:35,【超柔版】男深灰,XXXL,挺暖和的，就是会掉毛。
j***n,2016-12-26 10:59:33,【尊享版】男藏青,L,太紧没弹性
谢***4,2016-12-26 10:55:26,[升级版]男藏青,L,还行吧。
只***8,2016-12-26 10:54:07,【尊享版】女紫色,XXL,衣服很好，买给老人的，很柔软
只***8,2016-12-26 10:54:07,【尊享版】男深灰,XXL,衣服很好，买给爷爷的，很柔软
王***8,2016-12-26 10:52:34,[升级版]男藏青,XXL,南极人的保暖很好的
王***8,2016-12-26 10:52:34,[升级版]男藏青,XL,衣服很帮的
刘***0,2016-12-26 10:50:01,【超柔版】男酒红,XL,保暖不错很时尚
轻***3,2016-12-26 10:49:25,【超柔版】男深灰,XL,赞
他***至,2016-12-26 10:49:14,【尊享版】男深灰,XXL,买给爸爸的，他说质量很好，冬天很保暖！
掸***8,2016-12-26 10:47:58,[升级版]男浅灰,XXL,整体不错，弹力不是很大，老公胖穿着裆低腿紧
p***0,2016-12-26 10:47:39,【尊享版】男浅灰,XL,东西不错   有点薄
可***4,2016-12-26 10:47:14,【超柔版】男藏青,XXL,宝贝质量很好，穿着也舒服！快递也很快！
可***4,2016-12-26 10:46:16,【超柔版】女红色,XXL,好评，宝贝质量很好，穿着舒适，舒服！
可***4,2016-12-26 10:46:16,【超柔版】男藏青,XL,宝贝很好，物流也很快，质量很好！
t***0,2016-12-26 10:46:03,【超柔版】男藏青,XL,好评
j***b,2016-12-26 10:42:22,【超柔版】男深灰,XXL,衣服非常不错，穿着跟暖和，外面这个价买不到。
c***4,2016-12-26 10:41:51,[升级版]女魅力黑,XXL,没有红色的厚
s***7,2016-12-26 10:41:40,【超柔版】女红色,L,保暖性还可以，码子偏小，喜欢紧身买大一码，松身买大二码
s***7,2016-12-26 10:41:40,【尊享版】女红色,XL,保暖性还可以，码子偏小，喜欢紧身买大一码，松身买大二码
s***7,2016-12-26 10:41:40,【超柔版】女黑色,L,保暖性还可以，码子偏小，喜欢紧身买大一码，松身买大二码
l***6,2016-12-26 10:41:34,【超柔版】男深灰,L,可以
乔***4,2016-12-26 10:40:56,【尊享版】男浅灰,XL,质量不错，手感摸着也很舒服
z***9,2016-12-26 10:40:15,【超柔版】男深灰,XXXL,质量不好，穿两天就脱线了，大家一定不要上当
z***9,2016-12-26 10:40:15,【超柔版】男藏青,L,质量不好，穿两天就脱线了
收***3,2016-12-26 10:36:21,【超柔版】男藏青,XXL,还可以
琼***败,2016-12-26 10:33:46,【尊享版】男深灰,XXL,此用户没有填写评论!
j***3,2016-12-26 10:33:29,【尊享版】女红色,M,给妈妈买的 说有点掉色 其他的都还好
t***1,2016-12-26 10:30:09,【超柔版】男深灰,XXXXL,还行
z***8,2016-12-26 10:29:26,【尊享版】男浅灰,XXXL,感觉有点薄，穿着还可以，要是能再厚一点就更好了
类***漠,2016-12-26 10:29:20,[升级版]男藏青,XXXL,挺厚实的。
杭***市,2016-12-26 10:28:31,【尊享版】男深灰,L,衣服收到了，跟图片的一样，是我想要的
豆***神,2016-12-26 10:26:41,【超柔版】男深灰,XXL,应该挺好的
b***6,2016-12-26 10:24:50,【尊享版】男藏青,XXL,给男朋友买的，暖和，保暖衣就是要穿内层有绒的才舒服
t***7,2016-12-26 10:24:30,【尊享版】女紫色,XXL,还没穿呢
我***学,2016-12-26 10:24:17,【尊享版】女紫色,L,很薄
我***学,2016-12-26 10:24:17,[升级版]男深灰,XXXXL,不错
t***8,2016-12-26 10:23:03,[升级版]男藏青,XL,一般般，还行吧
z***0,2016-12-26 10:22:45,[升级版]男深灰,XL,这个款式很好，也很暖和，推荐这家！
流***1,2016-12-26 10:21:55,【尊享版】男藏青,XXL,不错
流***1,2016-12-26 10:21:55,【尊享版】男深灰,XXL,很喜欢
爱***明,2016-12-26 10:20:26,【尊享版】男深灰,XXXL,哎呀我去，比实体店便宜多了，很舒服穿起来，今年冬天更暖和了，已经买了好多套了！！以后的保暖衣就在你家了，推荐购买
那***下,2016-12-26 10:20:02,【尊享版】男深灰,L,物有所值，保暖的。
淡***切,2016-12-26 10:19:44,[升级版]男藏青,XL,衣服很厚实，很保暖。！！！
1***云,2016-12-26 10:19:21,【尊享版】女紫色,XXL,太薄啦！
1***云,2016-12-26 10:19:21,【尊享版】男藏青,XL,太薄啦
z***凉,2016-12-26 10:17:33,【尊享版】男深灰,XXXL,衣物合身之程度超乎想象，舒适感也大不相同，极为轻薄柔软，恍若未觉，实为多年来首次，如若明年初冬仍有飘雪，又遇寒冰，则阿里不倒，淘宝尚在，余必再来此叨扰
m***8,2016-12-26 10:15:42,【尊享版】男深灰,XXL,太薄了
购***r,2016-12-26 10:15:15,[升级版]男深灰,XL,不咋滴
爷***8,2016-12-26 10:13:41,【尊享版】男酒红,L,第二次买了，暖和是暖和，睡觉不好穿上会起球
灬***灬,2016-12-26 10:12:38,【超柔版】女黑色,L,很好！
乖***3,2016-12-26 10:11:39,【超柔版】男深灰,XXXL,好评，还不错！
莹***生,2016-12-26 10:10:32,【超柔版】男深灰,XXXXL,宝贝收到了，质量超好，感觉自己好像拍大了，不过，还好了，能穿，
x***8,2016-12-26 10:10:12,【尊享版】女紫色,XXL,宝贝质量很好，发货速度快
y***6,2016-12-26 10:08:38,[升级版]男深灰,XL,摸起来不错的。质量挺好的吧
y***6,2016-12-26 10:08:38,[升级版]男深灰,L,摸起来不错的。质量挺好的吧
上***3,2016-12-26 10:08:04,【超柔版】男藏青,XXL,感觉是假的，不值这个价
d***1,2016-12-26 10:07:54,【超柔版】男藏青,XXL,质量不咋地，不值这个价
t***9,2016-12-26 10:06:09,【尊享版】男浅灰,XL,第二次买，很好，这次拍的比上次大一码，穿着舒服多了，赞一个、以后还过来
w***8,2016-12-26 10:05:04,【超柔版】女紫色,XL,好评
纪***屋,2016-12-26 10:03:49,【超柔版】男浅灰,L,还不错
x***8,2016-12-26 10:03:23,[升级版]女魅力黑,XXL,看着大，穿起来刚刚好，很保暖
p***8,2016-12-26 10:02:44,【尊享版】男浅灰,L,无色差，版型也不错，很柔软，不过没想象中的那么厚，这个价位的话还是值得的
夜***绝,2016-12-26 09:58:41,【超柔版】女黑色,L,感觉不是正品吧。买回来和以前在店里面买的尺寸差好多&hellip;&hellip;搞得穿都不舒服。
不***由,2016-12-26 09:57:39,【尊享版】男浅灰,XXXL,一样的价格没有我以前在别家买的厚的，这是实话。
不***由,2016-12-26 09:57:39,【超柔版】男深灰,XXXL,一样的价格没有我以前在别家买的厚，这是实话。
f***生,2016-12-26 09:55:23,【超柔版】男咖啡,L,好评
0***饭,2016-12-26 09:54:15,【超柔版】男浅灰,XXXL,买给父亲的  ，很合身，因为衣服比较长，能护住腰，非常厚实保暖，很不错。
t***3,2016-12-26 09:54:01,【尊享版】男浅灰,XXL,不错，
我***i,2016-12-26 09:53:20,【尊享版】男浅灰,L,质量挺好，物流超快，值得购买！
汪***6,2016-12-26 09:52:42,【尊享版】男藏青,L,看起来还可以！物流很给力，值得好评
汪***6,2016-12-26 09:52:42,【尊享版】女黑色,M,看起来还可以！物流很给力，值得好评
y***0,2016-12-26 09:50:36,[升级版]女中国红,XL,还行，买来结婚穿的
y***0,2016-12-26 09:50:36,【尊享版】男藏青,XXL,还可以，买来结婚穿的
你***o,2016-12-26 09:50:29,【尊享版】男浅灰,XXL,俩字儿 暖和  仨字儿 好暖和
任***鸟,2016-12-26 09:50:13,【尊享版】女红色,XXL,用手摸了手感不错，老妈本命年特地买给她的
渝***风,2016-12-26 09:50:01,[升级版]女紫罗兰,M,很好 物廉价美
渝***风,2016-12-26 09:50:01,【尊享版】女红色,L,很好 物廉价美
l***速,2016-12-26 09:48:47,【超柔版】男深灰,XXXL,宝贝收到了，穿上很合身很舒服，质量特别好，卖家的服务态度很热情，物流很给力，很满意的一次购物！
冯***奎,2016-12-26 09:45:08,【尊享版】男浅灰,XXXL,比较薄
我***f,2016-12-26 09:43:33,【超柔版】男藏青,XXXXL,好
灰***你,2016-12-26 09:43:17,【尊享版】女黑色,L,掉毛
q***8,2016-12-26 09:42:41,【超柔版】男深灰,XXXXL,总体来说这个价格真心不错了！
杰***楠,2016-12-26 09:42:39,【尊享版】男深灰,XL,第二件了.这次买的居然是薄款
y***1,2016-12-26 09:38:35,【尊享版】男浅灰,L,收到宝贝很不开心，包装都破损的，质量感觉非常差，跟去年对比的话没法形容，这次是最糟糕的一次购物。
酷***5,2016-12-26 09:38:00,【超柔版】男藏青,XL,此用户没有填写评论!
y***8,2016-12-26 09:37:21,[升级版]男深灰,XXXXXL,挺好的
亮***族,2016-12-26 09:36:59,【超柔版】男藏青,XXXL,货收到了质量不怎么样？
朝***半,2016-12-26 09:36:58,[升级版]男浅灰,XXXL,还是语音码字舒服。就跟这衣服穿上身一样舒服。这个保暖就是好，比之前买的良心多了。
t***8,2016-12-26 09:36:25,【超柔版】男深灰,XXL,有点薄，北方的冬天太冷
d***8,2016-12-26 09:35:37,【尊享版】男深灰,XL,东西很好 挺不错的 没啥问题
朝***半,2016-12-26 09:34:35,[升级版]女紫罗兰,XL,在这店家买了一件衣服后，觉得不错后来给全家都来了一份。值得拥有
o***4,2016-12-26 09:33:23,【超柔版】男浅灰,XXXL,送人的，他说挺好
x***红,2016-12-26 09:33:18,【超柔版】男藏青,XL,不错
1***毒,2016-12-26 09:33:16,【超柔版】男深灰,XXXL,质量还是不错的，穿着舒服，值得大家购买
朝***半,2016-12-26 09:33:12,[升级版]男深灰,XXXL,先前买了一件试穿了推荐的尺码非常合适。也保暖就是零下也不怕?
韦***云,2016-12-26 09:31:47,【尊享版】男深灰,XXL,买给爸爸的，很暖很好的
程***0,2016-12-26 09:31:04,【超柔版】女黑色,XXXXL,还可以，就是有点薄了，
程***0,2016-12-26 09:31:04,[升级版]男深灰,XXXXXL,还可以，就是有点薄，
h***g,2016-12-26 09:27:47,【尊享版】男浅灰,XL,洞口边都没搞
爱***5,2016-12-26 09:26:17,【超柔版】男深灰,XXL,厚度还可以，穿上第一天裆部就破了，长短差不多，就是局部有些瘦。下评。
痴***7,2016-12-26 09:24:46,【超柔版】男浅灰,XXL,很好很暖穿着很舒服
0***0,2016-12-26 09:22:19,[升级版]男藏青,XXL,很好
0***0,2016-12-26 09:22:19,【尊享版】男深灰,XXL,很好
s***0,2016-12-26 09:20:31,【尊享版】男浅灰,XL,挺舒服的
x***7,2016-12-26 09:19:09,[升级版]女魅力黑,M,衣服褪色，收到以后衣服严重褪色，掉毛。
黛***归,2016-12-26 09:18:22,【尊享版】男藏青,XXL,还行，建议买大一号的
t***8,2016-12-26 09:13:00,【超柔版】男藏青,XXL,衣服里面加绒的很厚 穿起来很保暖 好评
念***儿,2016-12-26 09:13:00,【超柔版】男藏青,XL,很合身
l***8,2016-12-26 09:11:29,[升级版]男藏青,XXL,给爸爸买的听说穿上挺舒服的，下次还会来的。好评，五分！
l***8,2016-12-26 09:11:29,[升级版]女紫罗兰,L,给妈妈买的听说穿上挺舒服的，下次还会来的。好评，五分！
汤***7,2016-12-26 09:10:50,【尊享版】男深灰,XXL,物美价廉。穿着舒服，而且很保暖。
转***云,2016-12-26 09:10:09,[升级版]男藏青,L,老爸160左右 重120左右  买的L码 上衣合适
王***1,2016-12-26 09:09:37,【尊享版】男浅灰,XL,贴身很舒服，南极人实体店买了很多次，都没让我失望。这次也满意！好评！
e***0,2016-12-26 09:09:34,[升级版]男浅灰,XXXL,升级版不太厚，不太冷的时候也可以穿，懒得退了。
雪***裳,2016-12-26 09:09:27,【超柔版】男深灰,XXXXL,很好、给老爸买的
刘***昊,2016-12-26 09:09:13,【尊享版】男深灰,XL,刚收到，还没试穿，不过看上去还是不错的。希望衣服不会起球变形咯！
黎***6,2016-12-26 09:06:13,【尊享版】女黑色,L,看起来蛮厚的，摸起来也可以
t***3,2016-12-26 09:05:01,[升级版]女紫罗兰,XXL,衣服打开看了一下，还不错，我是买给我妈穿的所以还没试穿
h***o,2016-12-26 09:04:58,【尊享版】女紫色,XXXL,帮奶奶买的 应该会喜欢
z***5,2016-12-26 09:03:18,[升级版]男藏青,L,保暖内衣还行   这个价位确实物美价廉  不想别的保暖内衣哪么薄
f***辉,2016-12-26 09:02:09,【超柔版】男浅灰,XL,质量不错
丶***彡,2016-12-26 08:59:34,【尊享版】女紫色,L,非常好的啊
丶***彡,2016-12-26 08:59:34,【尊享版】男浅灰,XXL,很舒服的啊
呗***瑞,2016-12-26 08:59:15,【超柔版】女黑色,M,嗯，还不错，。
个***飞,2016-12-26 08:57:43,[升级版]男深灰,L,衣服第二次买了，很不错。穿在身上非常的舒服。
q***8,2016-12-26 08:53:38,【超柔版】男酒红,L,暖和，必须暖个。
丫***啦,2016-12-26 08:52:20,【尊享版】男藏青,XL,衣服购买到　卖家不理人。让人很失望
王***3,2016-12-26 08:51:00,【超柔版】男浅灰,XXL,质量很好，就是太薄
t***0,2016-12-26 08:48:33,【尊享版】男浅灰,XXL,小了
水***贤,2016-12-26 08:48:05,【超柔版】男藏青,XL,质量可以，很舒服。
l***n,2016-12-26 08:40:02,【尊享版】男浅灰,XXXL,好评
t***1,2016-12-26 08:39:17,【超柔版】男浅灰,L,好评，好穿再来买
t***1,2016-12-26 08:39:17,【超柔版】女黑色,L,衣服很好，这个价位买到算！
从***业,2016-12-26 08:38:59,【超柔版】男咖啡,XXL,热是真热啊，而且还很厚！
从***业,2016-12-26 08:38:59,【超柔版】男深灰,XXL,热是真热啊，而且还很厚！
8***1,2016-12-26 08:35:55,[升级版]男深灰,XL,很暖和给爸爸买的他很喜欢。
z***9,2016-12-26 08:34:54,【尊享版】男深灰,XXL,还可以
z***9,2016-12-26 08:34:54,【超柔版】男藏青,XXL,还么样
z***9,2016-12-26 08:34:54,【尊享版】男藏青,XXL,来了呀
单***1,2016-12-26 08:34:24,[升级版]男深灰,XL,稍微薄了点，还好
华***莉,2016-12-26 08:33:35,【尊享版】女黑色,XL,材料无双12买的好，但不讲够了，凑合吧。
笔***默,2016-12-26 08:31:05,【超柔版】女黑色,XL,感觉有点薄，质量一般。。
1***n,2016-12-26 08:30:26,【尊享版】女紫色,M,买给奶奶孝心保暖衣，她可喜欢了！
1***n,2016-12-26 08:30:26,【尊享版】男深灰,L,买给爷爷孝心保暖衣，他很喜欢！
华***飞,2016-12-26 08:25:46,【超柔版】男深灰,XXXL,这个冬天靠你了
我***7,2016-12-26 08:22:38,【超柔版】男酒红,L,质量很好，值得购买
t***0,2016-12-26 08:21:49,【超柔版】男藏青,L,不错 穿起来很舒服
起***市,2016-12-26 08:12:56,【尊享版】男深灰,L,买给爸爸的很保暖 跟图片一样没有色差 很满意的一次购物 给五颗星
边***行,2016-12-26 08:11:10,【尊享版】男深灰,XL,家人很喜欢，柔软亲肤，穿着舒服，大小合适，颜色很正，好评！好评！
边***行,2016-12-26 08:11:10,【尊享版】男酒红,XL,家人很喜欢，柔软亲肤，穿着舒服，大小合适，颜色很正，好评！好评！
边***行,2016-12-26 08:11:10,【尊享版】男深灰,XXL,家人很喜欢，柔软亲肤，穿着舒服，大小合适，颜色很正，好评！好评！
李***5,2016-12-26 08:11:01,【尊享版】男浅灰,L,还行，不掉毛，但是买小了点点
t***3,2016-12-26 08:07:01,【超柔版】男藏青,XXXXXL,不错，穿上很贴身
买***3,2016-12-26 08:05:46,【超柔版】男藏青,XXXL,号码3xL还是小了一点，穿着挺暖和的
梦***夕,2016-12-26 08:05:11,【尊享版】男浅灰,XL,还好
f***8,2016-12-26 08:04:32,【超柔版】男浅灰,XXXXL,ok
f***8,2016-12-26 08:04:32,【超柔版】男深灰,XXL,ok
安***a,2016-12-26 08:03:56,【尊享版】男浅灰,XL,质量挺好的，挺喜欢的。
张***5,2016-12-26 08:03:44,【超柔版】女紫色,XXL,挺好的，给奶奶买的，老人家说很暖和
w***0,2016-12-26 08:02:17,【超柔版】男藏青,XXXXXL,尺码标准的  五星好评
c***1,2016-12-26 07:52:50,【尊享版】男藏青,XL,衣服看起来很不错，质量绝对ok
c***1,2016-12-26 07:52:50,【超柔版】男咖啡,XL,质量不错哦，很满意。
右***2,2016-12-26 07:52:34,[升级版]女紫罗兰,XXL,还没穿，穿过再来
李***0,2016-12-26 07:45:20,[升级版]男深灰,XXXL,真心不好。还没去年我买40几块的厚，这评论没差评。有的话我给差评差评
吴***4,2016-12-26 07:42:07,【超柔版】女黑色,L,收货一天，袖口就爆线了，问了卖家，什么补救措施都没有，真的是很不负责任的卖家，大家别相信他，好评都是刷出来的！
m***8,2016-12-26 07:39:06,【超柔版】男深灰,L,就是有点偏小
女***弹,2016-12-26 07:32:54,【尊享版】男藏青,XXL,好薄
k***6,2016-12-26 07:31:52,【超柔版】男浅灰,XXXL,东西不错。
t***0,2016-12-26 07:31:42,【超柔版】男藏青,XL,质量不错，加绒的够厚够保暖了
邛***子,2016-12-26 07:28:47,【超柔版】男深灰,XXXL,大小合适，满意
鲁***干,2016-12-26 07:27:49,【尊享版】男深灰,XL,质量还行吧
鲁***干,2016-12-26 07:27:04,【尊享版】男藏青,XL,质量还行吧
暮***颜,2016-12-26 07:24:17,【超柔版】男深灰,L,偏小
暮***颜,2016-12-26 07:24:17,【超柔版】男浅灰,L,偏小
l***2,2016-12-26 07:23:30,【超柔版】男墨绿,XL,满意
真***啊,2016-12-26 07:20:37,【尊享版】男浅灰,XL,真的很保暖，一件就很暖和，穿上也很舒服。
a***6,2016-12-26 07:20:33,【超柔版】男酒红,XXXL,没有管物流，却没想到没到货，系统却自己收单了，要哭死，还好马上跟店家联系了，店家说丢件了，马上给我补上，三四天就到货了，质量也不错&hellip;&hellip;
l***o,2016-12-26 07:19:32,【超柔版】男藏青,XXL,衣服质量很好，也很暖和，冬天穿非常适合，店主很周到，快递速度也很快。
小***天,2016-12-26 07:16:01,【超柔版】男藏青,L,保暖性毋庸置疑，但是弹力不太够，穿了一个星期裤子破了，一分钱一分货吧
小***天,2016-12-26 07:16:01,【超柔版】男咖啡,XXL,保暖性毋庸置疑，但是弹力不太够，穿了一个星期裤子破了，一分钱一分货吧
苏***3,2016-12-26 07:03:54,[升级版]男深灰,L,穿着很暖和。
小***o,2016-12-26 06:46:36,[升级版]男浅灰,XL,挺厚实的，不错
再***人,2016-12-26 06:42:40,【超柔版】男酒红,XXL,货己收到，物流很快，两次购物都满意，给你好评5分
t***4,2016-12-26 06:37:47,[升级版]男浅灰,XXXL,此用户没有填写评论!
会***图,2016-12-26 06:14:05,【超柔版】男深灰,XL,给力    很满意???
张***8,2016-12-26 05:13:31,【尊享版】男深灰,XXL,不好意思   忘记了   穿着挺舒服的
上***佳,2016-12-26 04:23:03,【尊享版】男藏青,XXL,物流很快，衣服穿着很舒适，先后买了两套，价格也划算！
t***8,2016-12-26 02:35:10,[升级版]男深灰,XXXL,裤子分布不均匀，小腿太挤，裤裆太底
p***5,2016-12-26 02:13:05,[升级版]男藏青,XL,用了一段时间感觉还可以
y***0,2016-12-26 02:03:58,【尊享版】男深灰,L,偏小，不合身
s***1,2016-12-26 02:01:11,【超柔版】男藏青,XL,里面加绒的，很暖和，而且修身，超喜欢
