贝***云,2016-12-27 17:14:04,【尊享版】女黑色,XXL,很好
贝***云,2016-12-27 17:14:04,【超柔版】男浅灰,XXXXL,很好
贝***云,2016-12-27 17:14:04,【尊享版】男浅灰,XXXL,很好
执***1,2016-12-27 17:13:12,【尊享版】男深灰,XL,发货很快，尊享版比超柔版薄了一些，不过穿起来还可以，价格也比较便宜，已经买过好几件了，都很不错。
执***1,2016-12-27 17:13:12,【尊享版】女红色,XL,发货很快，尊享版比超柔版薄了一些，不过穿起来还可以，价格也比较便宜，已经买过好几件了，都很不错。
j***6,2016-12-27 17:07:03,【超柔版】男藏青,XXXL,值
m***8,2016-12-27 17:06:48,【超柔版】男深灰,L,很好，值得推荐
高***i,2016-12-27 17:04:32,【超柔版】女黑色,XL,好好好
文***8,2016-12-27 17:02:57,[升级版]男深灰,L,好
钟***诺,2016-12-27 17:02:31,【超柔版】男藏青,XL,衣服质量很差，不会发图 不然就发图给大家看了，以后肯定是不会再买了。
如***8,2016-12-27 17:02:17,【尊享版】女黑色,XXL,买给爷爷她们的的，初步感觉还可以
如***8,2016-12-27 17:02:17,【尊享版】男藏青,XXXL,买给爷爷奶奶，初步感觉还可以
j***8,2016-12-27 17:02:14,【尊享版】女红色,XXL,非常好！老妈很喜欢，穿着很漂亮，很舒服，很合适，大爱！
j***8,2016-12-27 17:02:14,【尊享版】女紫色,XXL,非常好，老妈很喜欢，穿着很漂亮，我又来买套，大爱！
t***3,2016-12-27 17:01:46,[升级版]男深灰,XL,特薄，不暖和
万***哥,2016-12-27 17:01:22,【尊享版】男深灰,XXXL,暖和
t***2,2016-12-27 17:00:30,【尊享版】女紫色,XL,很好，物有所值
健***0,2016-12-27 16:59:39,【超柔版】女红色,L,发货很快～质量还行～
t***5,2016-12-27 16:58:58,【尊享版】女紫色,XL,好评
开***泉,2016-12-27 16:57:19,【尊享版】男酒红,XL,怎么说呢？说实话吧，我是不满意的，一是尺码不准，本来我穿L，怕小买了XL，结果一穿跟M差不多，很紧；二是质量有瑕疵，前开口掩不住，重叠部分太少，内衬还没缝住，一翻就出来了，感觉不像真的南极人。几十块钱，不想寄来寄去了，不够麻烦的，就是跟售后反映一下，也给以后的买家提个醒吧，免得心里不舒服。看照片吧。
猪***飞,2016-12-27 16:56:29,【超柔版】男深灰,XXXXXL,衣服性价比还可以，没有有些评论中说的那么不堪
洛***你,2016-12-27 16:56:20,[升级版]男浅灰,XXXL,东西不错，暖和，好评
钟***诺,2016-12-27 16:54:10,【超柔版】男藏青,L,衣服买回来就是烂的，本来就是比较忙才会选择在网上购买，没注意看。客服还不退货 说话理都不理 简单就是垃圾。
不***姓,2016-12-27 16:51:33,【超柔版】男藏青,L,可以
w***乐,2016-12-27 16:51:21,【超柔版】男浅灰,L,很好
l***4,2016-12-27 16:51:17,[升级版]男藏青,XXXL,发货，物流都超快，衣服材质做工都不错，就是没想象中那么厚实，，总体满意
t***2,2016-12-27 16:50:53,【尊享版】男深灰,XXL,挺薄的 一般般啦
小***3,2016-12-27 16:49:24,【超柔版】男深灰,XXXL,上次买大了，给老爸穿了，这回买了小一号的，正好
t***6,2016-12-27 16:45:56,【超柔版】男藏青,XXXL,衣服还可以，有一些线头
王***7,2016-12-27 16:44:09,[升级版]女紫罗兰,XXL,挺好的
王***7,2016-12-27 16:44:09,[升级版]男藏青,XXL,挺好的
男***8,2016-12-27 16:43:06,【超柔版】男深灰,L,绒很舒服，很保暖，抵御严寒的最佳选择。
男***8,2016-12-27 16:43:06,【超柔版】男浅灰,L,物美价廉，小巧玲珑，高端大气。
雷***1,2016-12-27 16:42:45,【超柔版】男深灰,XL,老公很喜欢
雷***1,2016-12-27 16:42:45,【超柔版】男浅灰,XL,很不错
赵***宝,2016-12-27 16:40:57,【超柔版】男深灰,XXXL,好评
陈***3,2016-12-27 16:40:42,【超柔版】男酒红,XXXL,衣服太薄，嗯，不是想象中的酒红有些失望。
月***的,2016-12-27 16:40:22,[升级版]男藏青,XL,嗯还不错比较暖和  好评！！
你***9,2016-12-27 16:38:12,【尊享版】男藏青,XXL,还可以，好评。
1***u,2016-12-27 16:36:46,【尊享版】男浅灰,XXL,衣服质量挺不错的，很满意，店家服务态度也很好，下次还会光顾！
周***6,2016-12-27 16:32:56,【超柔版】男深灰,XXL,不错
一***买,2016-12-27 16:31:45,[升级版]男深灰,XXL,衣服已经收到，就是裤子有点薄，没想象中的那么厚，衣服但是可以
小***9,2016-12-27 16:31:42,【超柔版】女黑色,XXL,质量很好 很柔软
突***6,2016-12-27 16:30:15,【尊享版】男深灰,L,料子很软，摸着手感很舒服，穿着也很暖和。
江***3,2016-12-27 16:28:24,【超柔版】男藏青,XXXXL,好
k***c,2016-12-27 16:27:03,【超柔版】男藏青,L,质量太差了，起球又掉毛的
k***6,2016-12-27 16:25:43,[升级版]男深灰,L,质量太差了，跟秋衣差不多，劝大家不要买，我现在后悔死了
a***5,2016-12-27 16:24:30,【尊享版】男藏青,XXL,店家发的货一点都不好质量不好，我要两套不同颜色可店家给我发同颜色的，本要求退货可对方拒绝以后千万别买这家的货，实在太差了
l***7,2016-12-27 16:23:39,【超柔版】男浅灰,XXXL,质量不错。很保暖。
芭***莹,2016-12-27 16:22:57,【尊享版】男藏青,XL,比想象中小了点
本***卡,2016-12-27 16:21:26,[升级版]男藏青,XL,大家千万别上当！这个特别薄，尤其是裤子！一点都不保暖，比正常的冬天的秋裤都特么薄！千万别上当！千万别上当！千万别上当！便宜没好货！便宜没好货！便宜没好货！便宜没好货！
知***m,2016-12-27 16:21:21,【超柔版】男深灰,XXXXXL,严重差评，偏色骗子，以后绝对不回来第二次买你家东西。我在质问你，你为何不做声！！！还不支持传图功能！骗子欺骗消费者！！！差评。我不满意！！！没有教养的东西
就***玛,2016-12-27 16:21:20,【尊享版】男深灰,XL,好
为***8,2016-12-27 16:19:33,【尊享版】男浅灰,L,很不错的。面料摸起来很舒服。很贴身保暖。十分好评！
李***0,2016-12-27 16:18:36,【尊享版】男深灰,L,还是给个好坪吧，但是有点薄
c***4,2016-12-27 16:18:25,【尊享版】男深灰,XXL,还可以吧
爱***心,2016-12-27 16:17:25,【超柔版】男咖啡,XL,值得推荐，等我爸回来了，还会再来买几套！！
爱***心,2016-12-27 16:17:25,【超柔版】男藏青,XXL,第二次买了！！
万***贸,2016-12-27 16:17:07,【超柔版】男深灰,XL,东西不错品牌的真光毛毛
t***0,2016-12-27 16:14:07,[升级版]男藏青,XXXL,绝对正版，质量杠杠好
就***么,2016-12-27 16:13:29,【超柔版】男藏青,L,好评。绒绒很柔软，物流也快。
g***6,2016-12-27 16:13:12,【尊享版】男浅灰,XXXL,不吸汗  尺码偏小
s***2,2016-12-27 16:10:49,【尊享版】男浅灰,XXL,衣服还可以，就是有点薄，比想象中的薄
1***m,2016-12-27 16:10:04,【尊享版】女黑色,XXL,还可以
王***8,2016-12-27 16:09:38,【超柔版】女黑色,XL,态度差，
t***0,2016-12-27 16:07:27,[升级版]男浅灰,XL,说很暖
z***9,2016-12-27 16:05:33,【尊享版】女黑色,L,不错，很满意。
路***a,2016-12-27 16:05:16,【超柔版】男浅灰,XXXXL,挺好看的。爸爸很喜欢。
小***2,2016-12-27 16:04:35,【尊享版】男深灰,XL,帮朋友买的，朋友说保暖l质量还可以，是他想要买的那种！
小***2,2016-12-27 16:04:35,【尊享版】男浅灰,XL,帮朋友买的，朋友说保暖l质量还可以，是他想要买的那种！
赵***物,2016-12-27 15:59:28,【超柔版】男藏青,XXL,不错，很好
天***式,2016-12-27 15:58:26,【超柔版】男藏青,XXXXL,衣服很好，中间出现了一些小插曲，通过沟通都解决了，不错的衣服，值得推荐
a***书,2016-12-27 15:57:17,【超柔版】女紫色,M,还好，就是不知道洗了会不会缩水
p***9,2016-12-27 15:55:17,【超柔版】男浅灰,XXL,此用户没有填写评论!
t***2,2016-12-27 15:55:08,【尊享版】男深灰,XXL,宝贝质量不错！&hellip;&hellip;物流也很快！&hellip;&hellip;
杨***菲,2016-12-27 15:54:55,【尊享版】男浅灰,XL,挺好的、第三次买
q***4,2016-12-27 15:54:25,【超柔版】男深灰,XL,秋衣不错，挺实惠的，而且保暖，给我爸爸买的大小正好。也不气球，非常不错。
m***0,2016-12-27 15:53:44,【尊享版】男浅灰,XL,很暖和，对得起这个价格
q***9,2016-12-27 15:52:58,[升级版]男深灰,L,特别棒，就是袖子短了点点
a***6,2016-12-27 15:52:17,【尊享版】男藏青,XXL,宝贝У剑还满意
s***o,2016-12-27 15:52:04,【尊享版】男深灰,XL,刚收到宝贝，我以为挺厚的，但是摸上去有点薄。还没穿，回去再试试。
格***9,2016-12-27 15:51:47,【尊享版】男藏青,XL,包裹老爸买的，挺好价格美丽！
s***8,2016-12-27 15:50:59,【超柔版】女黑色,XXXL,非常不错哦，下次再来，衣服质量可以，快递贼快
s***8,2016-12-27 15:50:59,[升级版]男深灰,XXL,非常不错哦，下次再来，衣服质量绝对的，赞
莫***n,2016-12-27 15:50:05,【超柔版】男深灰,XL,挺好的~有点问题客服很快帮我解决了
骚***文,2016-12-27 15:48:17,【超柔版】男深灰,XL,还可以哦
a***1,2016-12-27 15:48:02,【超柔版】女黑色,M,料子很好，很暖和
t***2,2016-12-27 15:47:54,[升级版]男深灰,L,还好，不是想象那么厚实！
d***9,2016-12-27 15:47:52,【尊享版】男藏青,XXL,衣服有点薄，摸着还挺软
名***2,2016-12-27 15:47:16,【尊享版】男酒红,XL,非常薄的那种....
o***c,2016-12-27 15:46:56,【尊享版】男藏青,L,给爸爸买的，快递回家了，不知道怎样
c***6,2016-12-27 15:46:16,[升级版]男藏青,XL,裤子有点小，建议买大点号
孙***宝,2016-12-27 15:46:06,[升级版]男浅灰,L,宝贝收到很激动，没及时试穿，码偏小，结果穿了2天后发现裤子是破的，质量太差，差评差评
丢***四,2016-12-27 15:44:37,【尊享版】男藏青,XXXL,给爸爸买的，料子很柔软～
一***了,2016-12-27 15:43:22,【尊享版】男藏青,XXXL,非常不错，就是上衣有点短！
孙***心,2016-12-27 15:43:18,【尊享版】男藏青,XL,宝贝已经收到了，特意洗了下，一点儿都不掉毛，水也是清清的，质量很好，值得购买，准备再入手1套
t***2,2016-12-27 15:42:03,【尊享版】男藏青,XL,衣服还行，就是有点薄，就当打底衫穿吧，至少还有点绒，比衬衫好点
x***3,2016-12-27 15:41:46,【尊享版】男深灰,XL,衣服收到了，质感很好，非常的软和
晚***麦,2016-12-27 15:40:57,【尊享版】男浅灰,XL,可以，感觉偏小，买给爸的不知合适不。
晚***麦,2016-12-27 15:40:57,【尊享版】女红色,M,可以，还没穿，感觉值这个价。下次再来
t***0,2016-12-27 15:38:06,【超柔版】男深灰,XL,宝贝收到了   质量特别好   摸起来很柔软  很满意的一次购物  还会再次光顾的
安***淇,2016-12-27 15:37:20,【尊享版】男浅灰,XL,好评
z***6,2016-12-27 15:37:19,【超柔版】男咖啡,XXL,超柔软，大爱！
淮***哥,2016-12-27 15:37:07,[升级版]男藏青,XXL,很合身，卖家态度也非常棒，物流很给力。最中要的是宝贝很给力，穿着很暖和！
w***7,2016-12-27 15:33:57,【尊享版】男深灰,XXL,衣服质量挺好的，值得入手
d***e,2016-12-27 15:32:05,[升级版]男深灰,XXXL,穿了再追评
d***3,2016-12-27 15:30:16,[升级版]男深灰,XXL,太薄
三***9,2016-12-27 15:29:40,【尊享版】男藏青,XXXL,值得亲们入手
心***i,2016-12-27 15:28:37,【尊享版】男深灰,XXL,按照那个尺码标买的都偏小，袖子短了一截
o***o,2016-12-27 15:27:30,【超柔版】男酒红,XXXL,物流特别快 里面的绒很舒服软软的 下次再来
t***1,2016-12-27 15:27:13,【超柔版】男深灰,XXXXXL,挺好的，买的最大号，裤子合适，上衣大了。
酷***星,2016-12-27 15:26:21,【尊享版】男深灰,XXL,可以的给我吧买的，穿着挺舒服的
2***j,2016-12-27 15:25:22,【超柔版】女黑色,XL,衣服简直了，我的天差劲死了，穿上痒死了，还掉毛起球真是气死了，和二十块的东西没两样
2***j,2016-12-27 15:25:22,【尊享版】男浅灰,XXL,衣服简直了，我的天差劲死了，穿上痒死了，还掉毛起球真是气死了，和二十块的东西没两样
阿***主,2016-12-27 15:23:40,[升级版]女魅力黑,XXL,超大   169120xxl  能塞两个我
壶***骨,2016-12-27 15:23:19,[升级版]男藏青,XXL,客服三天没人回复 截了图留证
香***0,2016-12-27 15:21:10,【尊享版】男深灰,XL,质量不好，都还没有穿，洗了一水衣服就破了，尺码也不准，偏小
l***2,2016-12-27 15:20:26,【超柔版】男咖啡,L,质量不错，很保暖。毛毛也挺舒服的，值得入手！
c***7,2016-12-27 15:20:00,【超柔版】男酒红,XXXL,还没穿呢 不过南极人品牌应该很不错的
李***韩,2016-12-27 15:19:12,【尊享版】男深灰,XL,好
时***5,2016-12-27 15:18:51,【超柔版】男浅灰,XXL,质量超好，很喜欢 也没有色差  总之太喜欢了
z***n,2016-12-27 15:18:25,【超柔版】男浅灰,XL,不错，准备在买套
p***2,2016-12-27 15:17:50,【尊享版】男藏青,XL,还不错，帮朋友一次性买了两套，摸着手感不错，这个价钱能买到这样的保暖衣可以了，总的来说还是给好评
常***强,2016-12-27 15:15:55,[升级版]男浅灰,XXL,可以
t***2,2016-12-27 15:15:39,【尊享版】男深灰,XXL,质量挺好的！
我***1,2016-12-27 15:15:38,【尊享版】男酒红,XXL,这个价位能买到这么好的保暖内衣，真是物超所值。
你***纸,2016-12-27 15:15:12,【尊享版】男浅灰,XXL,很好，很暖和，就是裤头有点紧了
t***3,2016-12-27 15:14:33,【尊享版】女黑色,XL,回粘毛
闵***3,2016-12-27 15:11:27,【超柔版】男深灰,XXL,很好
袁***1,2016-12-27 15:11:15,【超柔版】男咖啡,L,还没打开看呢
y***o,2016-12-27 15:08:35,[升级版]男藏青,XXL,帮外公买的，希望他会喜欢
余***9,2016-12-27 15:08:22,【尊享版】男藏青,XXL,买小了一点
安***博,2016-12-27 15:08:11,[升级版]男深灰,XXXL,买的有点小了，
蒋***弟,2016-12-27 15:07:45,【超柔版】男深灰,XXXXXL,OK
亲***轩,2016-12-27 15:06:44,[升级版]男藏青,L,买过4套了，穿了真的舒服，所以跟亲戚朋友都介绍买了！
5***n,2016-12-27 15:06:20,【尊享版】男深灰,L,穿了一个礼拜！裤子就漏了一个洞！而且评价不让上图！说该宝贝不让上传图片！！找个客服还的排队！！我就想知道这就是你们的售后吗！！薄就不说了！烦死了
你***炫,2016-12-27 15:06:15,【尊享版】女黑色,XXL,物流速度快物品满意下次还回来
肖***馨,2016-12-27 15:04:36,【超柔版】男墨绿,XXXL,很厚，老公喜欢
t***8,2016-12-27 15:04:27,【超柔版】男咖啡,XXL,不错
吴***嘉,2016-12-27 15:04:15,【超柔版】女黑色,XXXXL,第二次购买了
徐***豆,2016-12-27 15:01:30,【超柔版】男藏青,XL,质量很差
l***4,2016-12-27 15:00:46,【超柔版】男深灰,XXL,之前拍的小了。又拍了个。穿着很舒服。
明***乐,2016-12-27 14:59:50,【超柔版】女黑色,M,还不错，衣服保暖，价格优惠，这个冬天挺好的！大小合适！
明***乐,2016-12-27 14:59:50,【超柔版】男藏青,XXL,此用户没有填写评论!
h***y,2016-12-27 14:59:17,[升级版]男浅灰,XL,不错！
1***y,2016-12-27 14:56:57,[升级版]女魅力黑,XL,不错
1***y,2016-12-27 14:56:57,[升级版]男深灰,L,不错
芩***子,2016-12-27 14:56:53,【尊享版】男深灰,L,质量超不好，太差了，第一次买到这么差的东西，又掉色  又掉毛
一***1,2016-12-27 14:52:48,【尊享版】男深灰,XL,挺好的
转***梦,2016-12-27 14:52:41,【尊享版】男酒红,XXXL,很好，很舒服
s***1,2016-12-27 14:52:40,【超柔版】男深灰,XXXL,质量好，值得购买，挺好！
枫***2,2016-12-27 14:51:13,【超柔版】男酒红,XL,质量没得说，有需要还会光临！
甜***淘,2016-12-27 14:50:42,[升级版]男藏青,XL,衣服很好 刚拿到就穿上了 暖暖的
田***家,2016-12-27 14:49:46,[升级版]男藏青,XL,很薄，有点失望
t***5,2016-12-27 14:47:32,【尊享版】男浅灰,XXL,穿着很舒服，很喜欢。
石***根,2016-12-27 14:45:41,【尊享版】男浅灰,XL,衣服不错，穿起来很舒服，很保暖
s***1,2016-12-27 14:45:10,【超柔版】男深灰,XXXL,宝贝不错，穿上好暖和
贵***萍,2016-12-27 14:45:07,【超柔版】男浅灰,L,柔软细腻，保温性好，富有弹性
屈***3,2016-12-27 14:43:57,【超柔版】男藏青,XXL,宝贝已收到感觉还可以，就是物流慢了点。
l***7,2016-12-27 14:43:18,[升级版]男藏青,XXL,质量不错，手感也不错 ，就是稍微薄点，还比较划算
l***7,2016-12-27 14:43:18,[升级版]女紫罗兰,XXL,质量不错，手感也不错 ，就是稍微薄点，还比较划算
品***局,2016-12-27 14:43:09,【尊享版】女黑色,L,宝贝收到了，挺好。
品***局,2016-12-27 14:43:09,【尊享版】女紫色,L,宝贝收到了，挺好
c***5,2016-12-27 14:42:31,【超柔版】女黑色,XXXXL,厚度刚好，物流也很给力，点个赞
品***局,2016-12-27 14:42:17,【尊享版】男藏青,XL,宝贝收到了，挺好
c***5,2016-12-27 14:41:09,【超柔版】女黑色,XXL,不错，第二次购买了，就是我想要的这种
一***中,2016-12-27 14:39:10,【超柔版】男深灰,XXL,码数偏小太多了～～
t***6,2016-12-27 14:37:36,[升级版]男藏青,XXL,很好
白***4,2016-12-27 14:37:31,【尊享版】男深灰,L,太薄了，质量一般，还起球
白***4,2016-12-27 14:37:31,【尊享版】女紫色,M,太薄了，质量一般，还起球
x***0,2016-12-27 14:37:10,【尊享版】女黑色,L,一般般啦
w***6,2016-12-27 14:36:36,[升级版]男深灰,XXXXL,做工质量  非常不好   线头  拼接点崩线   然后快递  真的慢呀  真不行
n***静,2016-12-27 14:32:30,[升级版]男深灰,XXL,质量还行，就是价钱有点贵，只有衣服上衣有黄色的部位，裤子看着是薄的。
t***6,2016-12-27 14:29:43,[升级版]男浅灰,XL,满意
引***3,2016-12-27 14:24:50,【超柔版】男藏青,XL,比想象的薄～～希望暖和吧
小***6,2016-12-27 14:24:37,【尊享版】女红色,M,买给女朋友的，M码还稍稍大了一点点，其他的挺好的
买***名,2016-12-27 14:23:14,[升级版]男浅灰,XXXL,确实薄，真是秋衣加了绒
晨***漫,2016-12-27 14:23:05,[升级版]男浅灰,XXXXXL,容易坏不怎么样
晨***漫,2016-12-27 14:23:05,[升级版]男深灰,XXXXXL,容易坏不怎么样
a***1,2016-12-27 14:21:25,【尊享版】女红色,XXXL,存在严重的质量问题，一穿衣服就坏了个大口子，联系客服客服不给解决！服务态度差，严重差评！
1***y,2016-12-27 14:20:24,【超柔版】男深灰,XXL,宝贝很厚实，舒服，质量很好，值的购买。
小***u,2016-12-27 14:19:20,【超柔版】男藏青,L,买了第一件感觉很好，才买第二件的，挺好的
a***w,2016-12-27 14:17:46,【尊享版】女红色,L,感觉一般，给婆婆穿的
张***4,2016-12-27 14:16:16,【超柔版】男藏青,XXXXL,很好的衣服，准备再入手一套，绝对物超所值！
h***h,2016-12-27 14:13:30,【超柔版】男深灰,XXL,此用户没有填写评论!
天***气,2016-12-27 14:12:59,[升级版]男浅灰,XXXL,不错挺好的
t***8,2016-12-27 14:10:47,【超柔版】女紫色,XL,一般般，一点都不厚，质量也不好，差评
t***8,2016-12-27 14:10:47,【超柔版】女黑色,XL,本来想送家人的，唉，质量差的要死，算了就这样吧！
蜀***牛,2016-12-27 14:09:23,【尊享版】女黑色,L,棒!
蜀***牛,2016-12-27 14:09:23,【尊享版】男酒红,XXL,好
蜀***牛,2016-12-27 14:08:53,【尊享版】男藏青,XXL,很好!
蜀***牛,2016-12-27 14:08:53,【尊享版】女红色,L,不错!
w***4,2016-12-27 14:08:26,【超柔版】男深灰,XL,挺好的。
6***凤,2016-12-27 14:07:30,【超柔版】男藏青,XXL,衣服还不错，快递挺快的。
w***4,2016-12-27 14:07:21,【超柔版】女紫色,XXL,质量还是挺好的，穿起来很舒服啦！
我***龙,2016-12-27 14:06:52,【超柔版】女紫色,XXL,还可以
h***e,2016-12-27 14:06:32,【超柔版】男藏青,XXXL,入手的第二件，买完第一件一直等节日特价，结果等不急了&hellip;&hellip;质量真心好，很保暖&hellip;&hellip;
s***i,2016-12-27 14:05:14,【超柔版】男深灰,XL,尺码偏小
x***4,2016-12-27 14:04:26,【超柔版】男藏青,XL,东西可以，已经第二次购买，非常不错的店家，下次需要还来你家买
l***米,2016-12-27 14:02:12,【尊享版】男深灰,XL,买给老爸的，很好很暖和
t***1,2016-12-27 14:01:55,【超柔版】男深灰,XXXL,不错，挺好的
d***h,2016-12-27 14:01:19,【超柔版】男藏青,XXL,码数不准，质量还行
d***h,2016-12-27 14:01:19,【尊享版】男深灰,XXL,码数不准，质量还行
l***底,2016-12-27 14:00:53,【超柔版】女紫色,XL,比较柔软舒适
w***q,2016-12-27 14:00:04,【尊享版】男深灰,XXL,太薄了
艾***2,2016-12-27 13:57:36,[升级版]男深灰,XL,太差了，和第一次买的完全不一样，料子差死了，会起球，差距太大
漂***9,2016-12-27 13:57:04,【超柔版】男酒红,XL,一般般。
l***a,2016-12-27 13:56:51,【超柔版】男藏青,XXL,暖和，好评
新***2,2016-12-27 13:56:08,【超柔版】男浅灰,XXL,东西还不错，挺保暖的，希望能耐穿
新***2,2016-12-27 13:56:08,[升级版]男藏青,XXL,东西还不错，挺保暖的，希望能耐穿
h***j,2016-12-27 13:55:38,【超柔版】男藏青,XXL,我老公说衣服超暖超厚实。值得购买，棒棒哒
汪***e,2016-12-27 13:55:27,【超柔版】男藏青,XXL,宝贝收到了，立马就穿起来，很舒适，尺码也刚刚好，保暖又有型，居家旅行，寒冬必备，下次还会过来帮家人买几件的，好评！
t***5,2016-12-27 13:52:55,[升级版]男深灰,XL,价格便宜，给公公买的，老人穿还是可以的
柏***1,2016-12-27 13:52:37,[升级版]男深灰,XXL,卖家信誉很好，买了很多次了，特别实用，然后面料特别舒服，父母特别喜欢，保暖性好。
柏***1,2016-12-27 13:52:37,【超柔版】男藏青,XXXXL,卖家信誉很好，买了很多次了，特别实用，然后面料特别舒服，父母特别喜欢，保暖性好。
柏***1,2016-12-27 13:52:37,【超柔版】女黑色,XXXL,卖家信誉很好，买了很多次了，特别实用，然后面料特别舒服，父母特别喜欢，保暖性好。
柏***1,2016-12-27 13:52:37,【超柔版】男酒红,XXXL,卖家信誉很好，买了很多次了，特别实用，然后面料特别舒服，父母特别喜欢，保暖性好。
芳***i,2016-12-27 13:51:47,【超柔版】女黑色,L,黑色的掉色好严重咯。。。。
柏***1,2016-12-27 13:51:43,【超柔版】女黑色,XXL,挺好的，一起给父母买的，一次够买了5件的，还用了特别舒适，还会在你家购买。
看***奋,2016-12-27 13:51:39,【超柔版】男浅灰,XL,和描述一致，质量不错，没有色差。老爸很喜欢！
t***9,2016-12-27 13:47:08,【超柔版】女黑色,XXL,给婆婆买的，说穿起来很暖和，在外面加一件衣服就可以过冬了?
新***馆,2016-12-27 13:44:24,【超柔版】女红色,L,不错，值得拥有
a***8,2016-12-27 13:41:26,[升级版]女中国红,XL,宝贝很好，穿着很暖和，喜欢的亲赶紧买吧，物流超快。。
c***p,2016-12-27 13:40:10,[升级版]男浅灰,XXL,好评！
米***彤,2016-12-27 13:38:47,【超柔版】男酒红,XL,衣服收到！质量很好！不掉色！给老公买的！他很喜欢
静***神,2016-12-27 13:38:14,[升级版]男深灰,XL,买来给老爸穿的，挺暖和
雪***护,2016-12-27 13:37:38,【尊享版】男浅灰,XL,很不错 很贴身 不松垮垮的 只比加厚的薄一点点 不对比也感觉不出来
睡***包,2016-12-27 13:37:16,【超柔版】男深灰,XL,客服不行，需要调教
永***白,2016-12-27 13:36:56,[升级版]男藏青,XXL,内衣很不错，就是物流很坑，发什么邮政！去个快递麻烦死了
t***7,2016-12-27 13:36:48,【超柔版】男酒红,XXXL,满意。
2***凤,2016-12-27 13:36:20,【超柔版】男藏青,L,给老公买的，质量真心不错
0***0,2016-12-27 13:35:04,[升级版]男深灰,XXL,此用户没有填写评论!
t***9,2016-12-27 13:32:24,【尊享版】男深灰,XXXL,一般
麦***l,2016-12-27 13:31:28,[升级版]女中国红,M,好评
a***a,2016-12-27 13:30:41,【尊享版】男深灰,L,好评
熊***狸,2016-12-27 13:28:09,【尊享版】女黑色,XL,挺厚实的，也很合身
j***3,2016-12-27 13:27:27,[升级版]男深灰,XXXXXL,此用户没有填写评论!
t***0,2016-12-27 13:26:58,【尊享版】女黑色,M,第二次来买了，加绒保暖内衣真的是御寒神器，不仅显瘦而且保暖，南极人一直都是我喜欢的品牌，以后还会继续支持
s***道,2016-12-27 13:23:13,【超柔版】男藏青,XXL,不错，穿点很舒服
i***d,2016-12-27 13:21:58,【尊享版】男藏青,XXXXXL,裤腿和袖子短了一塌糊涂，一洗更缩得跟个王8似的。
起***店,2016-12-27 13:21:58,【尊享版】男浅灰,XXL,好
人***你,2016-12-27 13:20:13,【尊享版】男浅灰,L,确实还不错 下次再买一件
伟***爷,2016-12-27 13:20:00,【超柔版】男藏青,L,挺好的
s***1,2016-12-27 13:19:13,【尊享版】男浅灰,XL,衣服偏大，客服建议XXL，我选择XL 回来穿着还有点大。
t***0,2016-12-27 13:17:48,【超柔版】男藏青,L,买的衣服洗了一次就直接扔掉了，上面粘的毛怎么弄都弄不掉，恶心死了！！！！！太不值了
小***希,2016-12-27 13:16:46,[升级版]女魅力黑,M,送人的，应该不错吧。
